Sarah,Foster,fostersarah14,F,foster14,2
The sky is the limit!
You will ace that exam!
Steph,Stelzer,stephcodes10,F,lovecoding3,0
Linette,Velez,linettetheengineer,F,engineergal7,2
You can do anything you want!
Focus on the now!
David,Smith,basicdude6,M,malelovescows,2
You are the coolest!
I am always here for you!
Blake,Johnson,doglover16,NB,dogsrcool4,0
Maggie,Robins,robinhood102,NB,money4poor,2
You have unlimited potential!
Your only obstical is yourself!
Steven,Maxwell,maxboy18,M,supbros98,4
Get those gains bro
Absorb the energy around you today
Meditate today
Focus on the positive today!